assignee,count
"ОБЩЕСТВО С ОГРАНИЧЕННОЙ ОТВЕТСТВЕННОСТЬЮ ""КуРэйт"" (ООО ""КуРэйт"")",5
"Федеральное государственное бюджетное образовательное учреждение высшего образования ""Московский государственный университет имени М.В. Ломоносова"" (МГУ)",4
"Российская Федерация, от имени которой выступает ФОНД ПЕРСПЕКТИВНЫХ ИССЛЕДОВАНИЙ",2
Телефонактиеболагет Лм Эрикссон (Пабл),2
"Открытое Акционерное Общество ""Информационные Технологии И Коммуникационные Системы""",2
Общество с ограниченной ответственностью «Международный центр квантовой оптики и квантовых вычислений» (ООО «МЦКТ»),2
"Общество с ограниченной ответственностью ""СМАРТС-Кванттелеком""",2
"Акционерное Общество ""Информационные Технологии И Коммуникационные Системы""",2
"Государственное образовательное учреждение высшего профессионального образования ""Таганрогский государственный радиотехнический университет"" (ТРТУ)",2
Квэлкомм Инкорпорейтед,2
Конинклейке Филипс Н.В.,2
МЕРК ШАРП И ДОУМ ЭлЭлСи,2
Федеральное государственное унитарное предприятие Российский федеральный ядерный центр - Всероссийский научно-исследовательский институт эксперементальной физики,1
Физико-технический институт им.А.Ф.Иоффе РАН,1
Фиске Софтваре Ллс,1
Фраунхофер-Гезелльшафт цур Фёрдерунг дер ангевандтен Форшунг Е.Ф.,1
"Хьюлетт-Паккард Дивелопмент Компани, Л.П.",1
Эмори Юниверсити,1
Эндресс+Хаузер Гмбх+Ко.Кг,1
Юниверсити Оф Теннесси Рисерч Фаундэйшн,1
"федеральное государственное автономное образовательное учреждение высшего образования ""Национальный исследовательский университет ИТМО"" (Университет ИТМО)",1
"федеральное государственное автономное образовательное учреждение высшего образования ""Санкт-Петербургский государственный политехнический университет"" (ФГАОУ ВО ""СПбПУ"")",1
"федеральное государственное автономное образовательное учреждение высшего профессионального образования ""Нижегородский государственный университет им. Н.И. Лобачевского""",1
"федеральное государственное бюджетное образовательное учреждение высшего образования ""Иркутский национальный исследовательский технический университет"" (ФГБОУ ВО ""ИРНИТУ"")",1
"федеральное государственное бюджетное образовательное учреждение высшего образования ""Российский государственный университет им. А.Н. Косыгина (Технологии. Дизайн. Искусство)""",1
"Федеральное государственное унитарное предприятие ""Научно-исследовательский институт прикладной акустики""",1
"Федеральное государственное унитарное предприятие ""Всероссийский научно-исследовательский институт метрологии им. Д.И. Менделеева""",1
Федеральное государственное бюджетное учреждение науки Физико-технологический институт Российской академии наук,1
"Государственное образовательное учреждение высшего профессионального образования ""Московский автомобильно-дорожный институт"" (Государственный технический университет)",1
ДАУ АГРОСАЙЕНСИЗ ЭлЭлСи,1
"Дженентек, Инк.",1
Елена Андреевна Чирясова,1
"Закрытое Акционерное Общество ""Время-Ч""",1
Институт геохимии им.А.П.Виноградова СО РАН,1
Институт динамики систем и теории управления Сибирского отделения Российской академии наук (ИДСТУ СО РАН),1
Интернэшнл Бизнес Машинз Корпорейшн,1
Кавокин Алексий Витальевич,1
Коммиссариат А Л` Энержи Атомик Э Оз Энержи Альтернатив,1
Конинклейке Филипс Электроникс Н.В.,1
"Корниенко Анатолий Адамович, Куренков Евгений Владимирович, Куштейко Григорий Павлович",1
Корнинг Инкорпорейтед,1
Кэнон Кабусики Кайся,1
Летно-исследовательский институт им.М.М.Громова,1
Либэль-Фларшайм Кампани ЭлЭлСи,1
Люмиледс Холдинг Б.В,1
МОЛ Мадьяр Олай- еш Газипари Ресвеньтаршашаг,1
Научно-исследовательское учреждение Институт физики им. Л.В. Киренского Сибирского отделения РАН,1
"Николай Владимирович Слюсарев, Григорий Леонидович Кошель, Владимир Сергеевич Осипов, Николай Иванович Охлобыстин",1
"Государственное унитарное предприятие ""НПО Астрофизика""",1
Государственное научное учреждение Всероссийский научно-исследовательский институт электрификации сельского хозяйства Российской академии сельскохозяйственных наук (ГНУ ВИЭСХ Россельхозакадемии),1
Федеральное государственное бюджетное учреждение науки Институт прикладной физики Российской академии наук (ИПФ РАН),1
"Владимир Фёдорович Матюхин, Светлана Владимировна Матюхина, Валентин Иоильевич Кишко",1
"Адиль Маликович Яфясов, Владислав Борисович Божевольнов, Борис Сергеевич Павлов, Иоаннис Антониу",1
"Акционерное общество Московский научно-производственный комплекс ""Авионика"" имени О.В. Успенского (АО МНПК ""Авионика"")",1
Алгодайн Ллс,1
Александр Викторович Принц,1
Александр Прокопьевич Елохин,1
Александр Яковлевич Гохштейн,1
Борис Андреевич Спасский,1
"ВНИИ разведочной геофизики ""Рудгеофизика""",1
Василий Алексеевич Сычев,1
Нокиа Мобайл Фоунс Лтд.,1
"ОАО ""Научно-исследовательский институт системотехники""",1
"Общество С Ограниченной Ответственностью ""Новые Энергетические Технологии""",1
"Общество С Ограниченной Ответственностью ""Сенсор Спин Технолоджис""",1
Силикса Лтд.,1
Снекма,1
"Солин Михаил Иванович, Акционерное общество открытого типа Корпорация ""ЯВА""",1
Термо Фишер Сайентифик Инк.,1
"Тяньцзинь Итун Электрик Текнолоджи Девелопмент Ко., Лтд.",1
ФГБОУ ВО Московский государственный университет технологий и управления имени К.Г. Разумовского (Первый казачий университет),1
Фега Грисхабер Кг,1
"Федеральное государственное автономное образовательное учреждение высшего образования ""Крымский федеральный университет имени В.И. Вернадского""",1
"Федеральное государственное автономное образовательное учреждение высшего образования ""Национальный исследовательский Нижегородский государственный университет им. Н.И. Лобачевского""",1
"Федеральное государственное бюджетное образовательное учреждение высшего образования ""Башкирский государственный университет""",1
"Федеральное государственное бюджетное образовательное учреждение высшего образования ""Казанский национальный исследовательский технический университет им. А.Н. Туполева - КАИ""",1
"Федеральное государственное бюджетное образовательное учреждение высшего образования ""Рязанский государственный радиотехнический университет имени В.Ф.Уткина""",1
"Федеральное государственное бюджетное образовательное учреждение высшего профессионального образования ""Воронежский государственный университет"" (ФГБОУ ВПО ""ВГУ"")",1
"Федеральное государственное бюджетное образовательное учреждение высшего профессионального образования ""Нижегородский государственный архитектурно-строительный университет"" (ННГАСУ)",1
"Федеральное государственное бюджетное образовательное учреждение высшего профессионального образования ""Рязанский государственный радиотехнический университет""",1
"Федеральное государственное бюджетное образовательное учреждение высшего профессионального образования ""Санкт-Петербургский национальный исследовательский университет информационных технологий, механики и оптики"" (""НИУ ИТМО"")",1
"Федеральное государственное бюджетное образовательное учреждение высшего профессионального образования ""Южно-Российский государственный университет экономики и сервиса"" (ФГБОУ ВПО ""ЮРГУЭС"")",1
"Федеральное государственное бюджетное учреждение науки Институт лазерной физики Сибирского отделения Российской академии наук, Федеральное государственное унитарное предприятие ""Всероссийский научно-исследовательский институт физико-технических и радиотехнических измерений""",1
Федеральное государственное бюджетное учреждение науки Институт общей физики им. А.М. Прохорова Российской академии наук (ИОФ РАН),1
"СиАрАрСи ЧЖУЧЖОУ ЭЛЕКТРИК ЛОКОМОУТИВ РИСЕРЧ ИНСТИТЬЮТ КО., ЛТД.",1
Си Эм Ти И ДИВЕЛОПМЕНТ ЛИМИТЕД,1
Септре Электроникс Лимитед,1
"Оксфорд Юниверсити Инновейшн Лимитед, Универсидад Эстадуал Паулиста ""Хулио Де Мескита Фильо"" - Унесп",1
"Общество с ограниченной ответственностью ""Гарант"" (ООО ""Гарант"")",1
"Общество с ограниченной ответственностью ""Лаборатория оптико-электронных приборов"" (ООО ""ЛОЭП"")",1
"Общество с ограниченной ответственностью ""НАУЧНО-ТЕХНИЧЕСКОЕ ОБЪЕДИНЕНИЕ ""ИРЭ-Полюс"" (ООО НТО ""ИРЭ-Полюс"")",1
"Общество с ограниченной ответственностью ""Радиационные технологии"" (ООО ""РадТех"")",1
"Общество с ограниченной ответственностью ""Солар Дотс""",1
Общество с ограниченной ответственностью «Лазерлаб» (ООО «Лазерлаб»),1
"Общество с ограниченной ответственностью Научно Исследовательская Компания ""Каскад""",1
Оксфорд Юниверсити Инновейшн Лимитед,1
Олег Дмитриевич Гурин,1
"Рикох Компани, Лтд., Тохоку Юниверсити",1
Омский государственный университет,1
"Открытое акционерное общество ""НИИ молекулярной электроники и завод ""Микрон""",1
"Открытое акционерное общество ""Российский институт радионавигации и времени""",1
Пермский государственный университет им.А.М.Горького,1
Пки Биотек Ас,1
Пол Рид Смит Гитарс Лимитед Партнершип,1
Пьер Фабр Медикамент,1
Пэрити Квантум Компьютинг ГмбХ,1
